{
  "$schema": "oebf://schema/0.1/slab",
  "id": "slab-roof-buildup",
  "type": "Slab",
  "description": "NMB-RF-01: BROOF (t4) roof build up, 350 mm",
  "ifc_type": "IfcRoof",
  "boundary_path_id": "path-slab-perimeter",
  "thickness_m": 0.35,
  "material_id": "mat-nmb-roof-buildup",
  "elevation_m": 6.252,
  "parent_group_id": "storey-ff",
  "properties": {
    "slab_type": "ROOF"
  },
  "tags": [
    "slab",
    "nmb"
  ]
}
