{
  "$schema": "oebf://schema/0.1/slab",
  "id": "slab-ff-finish",
  "type": "Slab",
  "description": "NMB-FL-01: internal floor finish allowance, 20 mm",
  "ifc_type": "IfcSlab",
  "boundary_path_id": "path-slab-perimeter",
  "thickness_m": 0.02,
  "material_id": "mat-nmb-floor-finish",
  "elevation_m": 3.0,
  "parent_group_id": "storey-ff",
  "properties": {
    "slab_type": "FINISH"
  },
  "tags": [
    "slab",
    "nmb"
  ]
}
