{
  "$schema": "oebf://schema/0.1/slab",
  "id": "slab-ff-insulation",
  "type": "Slab",
  "description": "NMB-FL-01: rigid insulation with underfloor heating, 35 mm",
  "ifc_type": "IfcSlab",
  "boundary_path_id": "path-slab-perimeter",
  "thickness_m": 0.035,
  "material_id": "mat-nmb-ufh-insulation",
  "elevation_m": 2.96,
  "parent_group_id": "storey-ff",
  "properties": {
    "slab_type": "INSULATION"
  },
  "tags": [
    "slab",
    "nmb"
  ]
}
